Kategorie,Frage,Antwort A,Antwort B,Antwort C,Antwort D,Schwierigkeit,Quelle,Überprüft,Ersteller
Multiple Choice,Was gehört nicht zur Definition eines Projektes?,projektspezifische Organisation,Zielvorgabe,teuer,zeitliche Begrenzung,,"Skript, Seite 5",Ja,alle
Ja/Nein,Gehört die Führungstechnik des Projektmanagers zum Projektmanagement?,Ja,Nein,,,,"Skript, Seite 6",Ja,alle
Sortieren,Sortieren Sie.,Kostenplan (4),Personalzuordnung (1),Terminplanung (3),Methoden und Hilfsmittel (2),,"Skript, Seite 12",Ja,alle
Multiple Choice,Welche Aufgabe gehört zum Projektmanagement?,Optimierung der Ressourcen,Catering,Programmieren,Networking,,"Skript, Seite 7",Ja,alle
Multiple Choice,Ein Wissensfeld des Projektmanagements ist Termin-,Vermeidung,Management,Verschiebung,Einsamkeit,,"Skript, Seite 8",Ja,alle